AppID,Name,Release date,Estimated owners,Peak CCU,Required age,Price,Discount,DLC count,About the game,Supported languages,Full audio languages,Reviews,Header image,Website,Support url,Support email,Windows,Mac,Linux,Metacritic score,Metacritic url,User score,Positive,Negative,Score rank,Achievements,Recommendations,Notes,Average playtime forever,Average playtime two weeks,Median playtime forever,Median playtime two weeks,Developers,Publishers,Categories,Genres,Tags,Screenshots,Movies
1888930,"The Last of Us™ Part I","Mar 28, 2023","500000 - 1000000",17498,17,59.99,0,0,"Experience the emotional storytelling and unforgettable characters in The Last of Us™, winner of over 200 Game of the Year awards. In a ravaged civilization, where infected and hardened survivors run rampant, Joel, a weary protagonist, is hired to smuggle 14-year-old Ellie out of a military quarantine zone. However, what starts as a small job soon transforms into a brutal cross-country journey. Includes the complete The Last of Us single-player story and celebrated prequel chapter, Left Behind, which explores the events that changed the lives of Ellie and her best friend Riley forever. Built for PC The Last of Us Part I PC release brings with it plenty of PC features to bring Joel and Ellie’s tense and unforgettable journey to life. This version of The Last of Us Part I is optimized for PC with PC-centric quality-of-life enhancements. Part I will feature AMD FSR 2.2 support*, Nvidia DLSS Super Resolution support*, VSync and frame rate cap options, and a host of features designed specifically for PC, including adjustable Texture Quality, Shadows, Reflections, Ambient Occlusion, and more. Through the experiences of Joel and Ellie, PC players can fully immerse themselves in beautiful yet haunting environments in stunning detail with true 4K resolutions**. From the harsh, oppressive streets of the Boston QZ to the overgrown and abandoned homes of Bill’s Town to so much more, embark on a beautiful journey across the United States of America with Ultra-Wide Monitor Support for both 21:9 Ultrawide and 32:9 Super Ultrawide aspect ratios. Experience all these locations, stealthily sneaking through abandoned homes and cities (and picking their drawers and cabinets clean looking for supplies) or engage in tense, captivating action with 3D audio support to better hear the rustle of leaves, the crack of glass, or the footfalls of enemies trying to ambush you***. AMD Fidelity FX Super Resolution 2 Supercharge your framerates and fight for survival as Joel and Ellie with next-level temporal upscaling technology from AMD. FSR 2 uses cutting-edge algorithms to boost your framerates and deliver high-quality, high-resolution game experiences in The Last of Us Part I across a wide range of compatible graphics cards. Peripheral Support The Last of Us Part I on PC features DualSense support through a wired connection so players can feel the impact of battle, the rumble of a tank rolling by, and so much more through haptic feedback and dynamic triggers. With support for the DualShock 4 controller, a wide range of other gamepads, and keyboard and mouse, players can adjust their playstyle to suit their preferences. The PC release includes a number of new control customization options including full control remapping, primary and secondary bindings for keyboard and mouse control, an adaptive mode that allows players to combine keyboard and controller inputs, and more. Part I’s PC launch will also include The Last of Us Part I’s suite of accessibility features so that players can adjust the experience to suit their needs and preferences. * Compatible PC and graphics card required for enhanced graphics. ** Compatible PC, graphics card, and 4K display device required. *** 3D Audio requires stereo headphones or compatible speakers.","['English', 'Italian', 'Spanish - Spain', 'Czech', 'Dutch', 'Greek', 'French', 'German', 'Danish', 'Finnish', 'Hungarian', 'Japanese', 'Korean', 'Norwegian', 'Polish', 'Portuguese - Brazil', 'Portuguese - Portugal', 'Russian', 'Simplified Chinese', 'Spanish - Latin America', 'Swedish', 'Thai', 'Traditional Chinese', 'Turkish', 'Croatian']","['English', 'Italian', 'Spanish - Spain', 'Greek', 'French', 'German', 'Japanese', 'Polish', 'Portuguese - Brazil', 'Portuguese - Portugal', 'Russian', 'Spanish - Latin America', 'Turkish', 'Croatian']","","https://cdn.akamai.steamstatic.com/steam/apps/1888930/header.jpg?t=1680282721","https://www.playstation.com/en-us/the-last-of-us/","https://www.playstation.com/en-us/support/","",True,False,False,0,"",0,9067,12035,"",29,13158,"Players use weapons such as pistols, rifles, and crafted explosives as well as melee attacks with chokeholds, bats, and metal pipes to defend themselves from the infected and other human survivors. Players can also engage in stealth combat sequences involving a close-up camera view. Weapon and explosive attacks can result in decapitation and/or dismemberment. Scenes depict intense acts of violence, including themes of suicide and torture. During the game, a character makes sexual remarks about an adult magazine and a young character is shown drinking alcohol. Strong language is used frequently in dialogue.",592,592,797,797,"Naughty Dog LLC","PlayStation PC LLC","Single-player,Steam Achievements,Full controller support,Steam Cloud,Remote Play on TV","Action,Adventure","Story Rich,Action,Zombies,Adventure,Singleplayer,Post-apocalyptic,Emotional,Cinematic,Violent,Great Soundtrack,Third-Person Shooter,Action-Adventure,Atmospheric,Third Person,Gore,Horror,Survival Horror,Drama,Multiplayer,Remake","https://cdn.akamai.steamstatic.com/steam/apps/1888930/ss_c2853eee7ca824c42e008e83f3f45ad42d9e8547.1920x1080.jpg?t=1680282721,https://cdn.akamai.steamstatic.com/steam/apps/1888930/ss_abc373417afe2172ddf7b6d91442a14366a46975.1920x1080.jpg?t=1680282721,https://cdn.akamai.steamstatic.com/steam/apps/1888930/ss_0330e4473e70f6c0850f38204d712d5aa66e6223.1920x1080.jpg?t=1680282721,https://cdn.akamai.steamstatic.com/steam/apps/1888930/ss_877f930b9b7fe4a57af1707cdaef64ed37213b4e.1920x1080.jpg?t=1680282721,https://cdn.akamai.steamstatic.com/steam/apps/1888930/ss_ec1a71230d4fb477282fa7f25688af37b702ce49.1920x1080.jpg?t=1680282721,https://cdn.akamai.steamstatic.com/steam/apps/1888930/ss_ea8b45bb65d05fafa911387df16399ead11e6878.1920x1080.jpg?t=1680282721,https://cdn.akamai.steamstatic.com/steam/apps/1888930/ss_1d4757f62cb17a674f451ab18136a87fe5959ad5.1920x1080.jpg?t=1680282721,https://cdn.akamai.steamstatic.com/steam/apps/1888930/ss_5d7cf9e0857d10924def80a1bb0ce8f5f8da1b02.1920x1080.jpg?t=1680282721,https://cdn.akamai.steamstatic.com/steam/apps/1888930/ss_3ee73e4d741ba90d9bbabaae105c3e6d2e7941a3.1920x1080.jpg?t=1680282721,https://cdn.akamai.steamstatic.com/steam/apps/1888930/ss_e67d2ca76b0c8985a3615afb38c21e893df73272.1920x1080.jpg?t=1680282721,https://cdn.akamai.steamstatic.com/steam/apps/1888930/ss_56a85dbf963bda77e1f9e7aefebbed025f33e6f3.1920x1080.jpg?t=1680282721,https://cdn.akamai.steamstatic.com/steam/apps/1888930/ss_32792cba98a3e8e807d1fdcd835202f46e2999c2.1920x1080.jpg?t=1680282721,https://cdn.akamai.steamstatic.com/steam/apps/1888930/ss_4a74a42ccfbaa370b38df2526719c7eaa173a0f5.1920x1080.jpg?t=1680282721","http://cdn.akamai.steamstatic.com/steam/apps/256936971/movie_max.mp4?t=1680015399,http://cdn.akamai.steamstatic.com/steam/apps/256936970/movie_max.mp4?t=1680015405,http://cdn.akamai.steamstatic.com/steam/apps/256936969/movie_max.mp4?t=1680015410,http://cdn.akamai.steamstatic.com/steam/apps/256936968/movie_max.mp4?t=1680015416"
499450,"The Witcher 3: Wild Hunt - Game of the Year Edition","Aug 29, 2016","0 - 0",0,0,0.0,0,0,"Game of the Year EDITION The Witcher 3: Wild Hunt Game of the Year edition brings together the base game and all the additional content released to date. Includes the Hearts of Stone and Blood &amp; Wine expansions, which offer a massive 50 hours of additional storytelling as well as new features and new areas that expand the explorable world by over a third! Affords access to all additional content released so far, including weapons, armor, side quests, game modes and new GWENT cards! Features all technical and visual updates as well as a new user interface completely redesigned on the basis of feedback from members of the Witcher Community. Become a professional monster slayer and embark on an adventure of epic proportions! Upon its release, The Witcher 3: Wild Hunt became an instant classic, claiming over 250 Game of the Year awards. Now you can enjoy this huge, over 100-hour long, open-world adventure along with both its story-driven expansions worth an extra 50 hours of gameplay. This edition includes all additional content - new weapons, armor, companion outfits, new game mode and side quests. Play as a Highly Trained Monster Slayer for Hire Trained from early childhood and mutated to gain superhuman skills, strength and reflexes, witchers are a distrusted counterbalance to the monster-infested world in which they live. Gruesomely destroy foes as a professional monster hunter armed with a range of upgradeable weapons, mutating potions, and combat magic. Hunt down a wide variety of exotic monsters, from savage beasts prowling mountain passes to cunning supernatural predators lurking in the shadowy back alleys of densely populated cities. Invest your rewards to upgrade your weaponry and buy custom armor, or spend them on horse races, card games, fist fighting and other pleasures life brings. Track Down the Child of Prophecy in a Morally Ambiguous Fantasy Open World Built for endless adventure, the massive open world of The Witcher sets new standards in terms of size, depth and complexity. Traverse a fantastical open world: explore forgotten ruins, caves and shipwrecks, trade with merchants and dwarven smiths in cities, and hunt across open plains, amidst mountains and at sea. In a time of war, track down the child of prophecy, a living weapon of great power whose coming was foretold in ancient elven legends. Make choices that go beyond good and evil and face their far-reaching consequences.","['English', 'French', 'Italian', 'German', 'Spanish - Spain', 'Arabic', 'Czech', 'Hungarian', 'Japanese', 'Korean', 'Polish', 'Portuguese - Brazil', 'Russian', 'Traditional Chinese', 'Turkish']","['English', 'French', 'German', 'Japanese', 'Polish', 'Portuguese - Brazil', 'Russian', 'Turkish']","","https://cdn.akamai.steamstatic.com/steam/apps/499450/header.jpg?t=1649895264","http://www.thewitcher.com","http://en.cdprojektred.com/support","http://en.cdprojektred.com/contact-support/",True,False,False,0,"",0,0,0,"",78,0,"",0,0,0,0,"CD PROJEKT RED","CD PROJEKT RED","Single-player,Steam Achievements,Full controller support,Steam Trading Cards,Steam Cloud","RPG","","https://cdn.akamai.steamstatic.com/steam/apps/499450/ss_107600c1337accc09104f7a8aa7f275f23cad096.1920x1080.jpg?t=1649895264,https://cdn.akamai.steamstatic.com/steam/apps/499450/ss_b14590222af38bdd4758bae8ddbfe3b5f48b22b0.1920x1080.jpg?t=1649895264,https://cdn.akamai.steamstatic.com/steam/apps/499450/ss_f0c1b0b1cae3b85dd4db7950363dea19060d9a52.1920x1080.jpg?t=1649895264,https://cdn.akamai.steamstatic.com/steam/apps/499450/ss_1bb41800b0d5fe81c181913be445468439c00b42.1920x1080.jpg?t=1649895264,https://cdn.akamai.steamstatic.com/steam/apps/499450/ss_3f434982591c193188090e66314fb4b745f1f160.1920x1080.jpg?t=1649895264,https://cdn.akamai.steamstatic.com/steam/apps/499450/ss_50b2c4d96fa1621ab40a158ce227f43d3de3a4bc.1920x1080.jpg?t=1649895264,https://cdn.akamai.steamstatic.com/steam/apps/499450/ss_32dd45852a5d2483771ea388423d1ed1b96418a1.1920x1080.jpg?t=1649895264,https://cdn.akamai.steamstatic.com/steam/apps/499450/ss_2c05b5a2dd6a00f61084ef8efe96257ff1c38488.1920x1080.jpg?t=1649895264,https://cdn.akamai.steamstatic.com/steam/apps/499450/ss_849ec8dcc6f8df1c0b2c509584c9fc9e51f88cfa.1920x1080.jpg?t=1649895264,https://cdn.akamai.steamstatic.com/steam/apps/499450/ss_8dda807b4e41d31900b156cc459f5cc584601837.1920x1080.jpg?t=1649895264,https://cdn.akamai.steamstatic.com/steam/apps/499450/ss_908485cbb1401b1ebf42e3d21a860ddc53517b08.1920x1080.jpg?t=1649895264,https://cdn.akamai.steamstatic.com/steam/apps/499450/ss_a820f90b2cba58a36170eb3d642abbdd2cacaf8c.1920x1080.jpg?t=1649895264,https://cdn.akamai.steamstatic.com/steam/apps/499450/ss_dc55eeb409d6e187456a8e159018e8da098fa468.1920x1080.jpg?t=1649895264,https://cdn.akamai.steamstatic.com/steam/apps/499450/ss_64eb760f9a2b67f6731a71cce3a8fb684b9af267.1920x1080.jpg?t=1649895264,https://cdn.akamai.steamstatic.com/steam/apps/499450/ss_07812c174bb6b96c29895ddc27404143df7aba6d.1920x1080.jpg?t=1649895264,https://cdn.akamai.steamstatic.com/steam/apps/499450/ss_4493bcdf9c6d4ad43304b98ac8e61a3035b020ee.1920x1080.jpg?t=1649895264,https://cdn.akamai.steamstatic.com/steam/apps/499450/ss_af8dc57a5f2989c6cd50088bf74d243370855a10.1920x1080.jpg?t=1649895264,https://cdn.akamai.steamstatic.com/steam/apps/499450/ss_ed23139c916fdb9f6dd23b2a6a01d0fbd2dd1a4f.1920x1080.jpg?t=1649895264","http://cdn.akamai.steamstatic.com/steam/apps/256669663/movie_max.mp4?t=1472511950,http://cdn.akamai.steamstatic.com/steam/apps/256669383/movie_max.mp4?t=1472512076,http://cdn.akamai.steamstatic.com/steam/apps/256669635/movie_max.mp4?t=1472512086,http://cdn.akamai.steamstatic.com/steam/apps/256669639/movie_max.mp4?t=1472512096,http://cdn.akamai.steamstatic.com/steam/apps/256669642/movie_max.mp4?t=1472512107"
1245620,"ELDEN RING","Feb 24, 2022","20000000 - 50000000",46431,16,59.99,0,0,"THE NEW FANTASY ACTION RPG. Rise, Tarnished, and be guided by grace to brandish the power of the Elden Ring and become an Elden Lord in the Lands Between. • A Vast World Full of Excitement A vast world where open fields with a variety of situations and huge dungeons with complex and three-dimensional designs are seamlessly connected. As you explore, the joy of discovering unknown and overwhelming threats await you, leading to a high sense of accomplishment. • Create your Own Character In addition to customizing the appearance of your character, you can freely combine the weapons, armor, and magic that you equip. You can develop your character according to your play style, such as increasing your muscle strength to become a strong warrior, or mastering magic. • An Epic Drama Born from a Myth A multilayered story told in fragments. An epic drama in which the various thoughts of the characters intersect in the Lands Between. • Unique Online Play that Loosely Connects You to Others In addition to multiplayer, where you can directly connect with other players and travel together, the game supports a unique asynchronous online element that allows you to feel the presence of others.","['English', 'French', 'Italian', 'German', 'Spanish - Spain', 'Japanese', 'Korean', 'Polish', 'Portuguese - Brazil', 'Russian', 'Simplified Chinese', 'Spanish - Latin America', 'Thai', 'Traditional Chinese']","['English', 'Traditional Chinese']","“Put a ring on it.” 10/10 – IGN “An unmissable open-world masterpiece.” 10/10 – Gaming Bible “Exploration is jaw dropping.” 5/5 – Games Radar","https://cdn.akamai.steamstatic.com/steam/apps/1245620/header.jpg?t=1654259241","","https://www.bandainamcoent.com/support","",True,False,False,94,"https://www.metacritic.com/game/pc/elden-ring?ftag=MCD-06-10aaa1f",0,460812,51238,"",42,391693,"",5293,403,4467,131,"FromSoftware Inc.","FromSoftware Inc.,Bandai Namco Entertainment","Single-player,Multi-player,PvP,Online PvP,Co-op,Online Co-op,Steam Achievements,Full controller support,Steam Trading Cards","Action,RPG","Souls-like,Relaxing,Dark Fantasy,RPG,Difficult,Open World,Action RPG,Third Person,Fantasy,Multiplayer,Online Co-Op,Singleplayer,Action,Co-op,PvP,Violent,Atmospheric,3D,Great Soundtrack,Walking Simulator","https://cdn.akamai.steamstatic.com/steam/apps/1245620/ss_e80a907c2c43337e53316c71555c3c3035a1343e.1920x1080.jpg?t=1654259241,https://cdn.akamai.steamstatic.com/steam/apps/1245620/ss_25cd489871907387c1b915022a96b196661b6e17.1920x1080.jpg?t=1654259241,https://cdn.akamai.steamstatic.com/steam/apps/1245620/ss_3e556415d1bda00d749b2166ced264bec76f06ee.1920x1080.jpg?t=1654259241,https://cdn.akamai.steamstatic.com/steam/apps/1245620/ss_ae44317e3bd07b7690b4d62cc5d0d1df30367a91.1920x1080.jpg?t=1654259241,https://cdn.akamai.steamstatic.com/steam/apps/1245620/ss_c372274833ae6e5437b952fa1979430546a43ad9.1920x1080.jpg?t=1654259241,https://cdn.akamai.steamstatic.com/steam/apps/1245620/ss_e87a3e84890ab19f8995566e62762d5f8ed39315.1920x1080.jpg?t=1654259241,https://cdn.akamai.steamstatic.com/steam/apps/1245620/ss_3aec1455923ef49f4e777c2a94dbcd0256f77eb0.1920x1080.jpg?t=1654259241,https://cdn.akamai.steamstatic.com/steam/apps/1245620/ss_b87601dee58f4dbc36e40a8d803dc6a53ceefe07.1920x1080.jpg?t=1654259241,https://cdn.akamai.steamstatic.com/steam/apps/1245620/ss_8b58d96262fb0d62a482621b86c6ff85f4f57997.1920x1080.jpg?t=1654259241,https://cdn.akamai.steamstatic.com/steam/apps/1245620/ss_1011610a0e330c41a75ffd0b3a9a1bac3205c46a.1920x1080.jpg?t=1654259241,https://cdn.akamai.steamstatic.com/steam/apps/1245620/ss_41e2e8f3b0ad631e929e0c2ec3d1f21de883e98c.1920x1080.jpg?t=1654259241,https://cdn.akamai.steamstatic.com/steam/apps/1245620/ss_7dcd7e6c42024c2d5a5a31d758039ded13a47527.1920x1080.jpg?t=1654259241,https://cdn.akamai.steamstatic.com/steam/apps/1245620/ss_abd681cde3402155a35edb82919b7602cc7ec338.1920x1080.jpg?t=1654259241,https://cdn.akamai.steamstatic.com/steam/apps/1245620/ss_0b6e59057b02392b21dde62b4dde65d447e1fa3c.1920x1080.jpg?t=1654259241,https://cdn.akamai.steamstatic.com/steam/apps/1245620/ss_7523a8fc7775ae65cabd94d092ebecbd963258b6.1920x1080.jpg?t=1654259241,https://cdn.akamai.steamstatic.com/steam/apps/1245620/ss_a176eea67cd421307a6c627514129237d6202890.1920x1080.jpg?t=1654259241,https://cdn.akamai.steamstatic.com/steam/apps/1245620/ss_ebb332e63dfab864c3bf3c3b1001b69f4da25f9f.1920x1080.jpg?t=1654259241,https://cdn.akamai.steamstatic.com/steam/apps/1245620/ss_24bd769aeffacd45fcd3a7ae9efde22b24b5fca9.1920x1080.jpg?t=1654259241,https://cdn.akamai.steamstatic.com/steam/apps/1245620/ss_75f25974c20b8704fe5ee246f74896b550088d3e.1920x1080.jpg?t=1654259241,https://cdn.akamai.steamstatic.com/steam/apps/1245620/ss_fb2957cce97f4633bc743b561f76865e6993c781.1920x1080.jpg?t=1654259241,https://cdn.akamai.steamstatic.com/steam/apps/1245620/ss_35ff7ed4b67e2bb73e54f6c10a4f8d9390c16203.1920x1080.jpg?t=1654259241","http://cdn.akamai.steamstatic.com/steam/apps/256889452/movie_max.mp4?t=1654109247,http://cdn.akamai.steamstatic.com/steam/apps/256875477/movie_max.mp4?t=1645743469,http://cdn.akamai.steamstatic.com/steam/apps/256864891/movie_max.mp4?t=1645830855,http://cdn.akamai.steamstatic.com/steam/apps/256859890/movie_max.mp4?t=1641845061,http://cdn.akamai.steamstatic.com/steam/apps/256839312/movie_max.mp4?t=1641422486"
374320,"DARK SOULS™ III","Apr 11, 2016","5000000 - 10000000",3657,17,59.99,0,3,"We are currently in the process of restoring the online servers for the DARK SOULS series on PC. We plan to restore online service for each game progressively, bringing back servers for DARK SOULS™ III once we complete the necessary work to correct the problem. We will provide additional updates as soon as the restoration schedule is finalized. We want to thank all our players for your patience and understanding as we work to fix this issue. Get the DARK SOULS™ III Season Pass now and challenge yourself with all the available content! Winner of gamescom award 2015 'Best RPG' and over 35 E3 2015 Awards and Nominations. DARK SOULS™ III continues to push the boundaries with the latest, ambitious chapter in the critically-acclaimed and genre-defining series. As fires fade and the world falls into ruin, journey into a universe filled with more colossal enemies and environments. Players will be immersed into a world of epic atmosphere and darkness through faster gameplay and amplified combat intensity. Fans and newcomers alike will get lost in the game hallmark rewarding gameplay and immersive graphics. Now only embers remain… Prepare yourself once more and Embrace The Darkness!","['English', 'French', 'Italian', 'German', 'Spanish - Spain', 'Polish', 'Russian', 'Portuguese - Brazil', 'Simplified Chinese', 'Traditional Chinese', 'Japanese', 'Korean']","['English', 'Korean']","“Dark Souls 3's incredible world and awe-inspiring weapon arts make it the fiercest installment yet.” 9.5/10 – IGN “Sprawling level design, thrilling combat, and masterful indirect storytelling make Dark Souls 3 the best Dark Souls yet.” 94% – PC Gamer “Dark Souls III successfully replicates the winning formula of the Souls series, a wondrous combination of majestic boss battles, incredible layered environments full of secrets, and precise combat that can make other action RPGs difficult to play once you’ve mastered the art.” 9.25/10 – Game Informer","https://cdn.akamai.steamstatic.com/steam/apps/374320/header.jpg?t=1653584490","","https://www.bandainamcoent.com/support","",True,False,False,89,"https://www.metacritic.com/game/pc/dark-souls-iii?ftag=MCD-06-10aaa1f",0,310407,21119,"",43,214707,"",5041,292,1926,184,"FromSoftware, Inc.","FromSoftware, Inc.,Bandai Namco Entertainment","Single-player,Multi-player,Co-op,Steam Achievements,Full controller support,Steam Trading Cards,Remote Play on Phone,Remote Play on Tablet,Remote Play on TV","Action","Souls-like,Dark Fantasy,Difficult,RPG,Atmospheric,Lore-Rich,Third Person,Exploration,Story Rich,Action RPG,Co-op,Great Soundtrack,Adventure,Action,PvP,Multiplayer,Open World,Singleplayer,Character Customization,Replay Value","https://cdn.akamai.steamstatic.com/steam/apps/374320/ss_5efd318b85a3917d1c6e717f4cb813b47547cd6f.1920x1080.jpg?t=1653584490,https://cdn.akamai.steamstatic.com/steam/apps/374320/ss_1c0fa39091901496d77cf4cecfea4ffb056d6452.1920x1080.jpg?t=1653584490,https://cdn.akamai.steamstatic.com/steam/apps/374320/ss_1318a04ef11d87f38aebe6d47a96124f8f888ca8.1920x1080.jpg?t=1653584490,https://cdn.akamai.steamstatic.com/steam/apps/374320/ss_61524dee9ebf72d462638f21adbbbea4c93d791d.1920x1080.jpg?t=1653584490,https://cdn.akamai.steamstatic.com/steam/apps/374320/ss_fe1dc6761a9004aa39c2e6e62181593b7263edf9.1920x1080.jpg?t=1653584490,https://cdn.akamai.steamstatic.com/steam/apps/374320/ss_27397db724cfd5648655c1056ff5d184147a4c50.1920x1080.jpg?t=1653584490,https://cdn.akamai.steamstatic.com/steam/apps/374320/ss_da36c88ae35d4f20c9d221a79592b31c080521d2.1920x1080.jpg?t=1653584490,https://cdn.akamai.steamstatic.com/steam/apps/374320/ss_12c4d9a3c04d6d340ffea9335441eb2ad84e0028.1920x1080.jpg?t=1653584490,https://cdn.akamai.steamstatic.com/steam/apps/374320/ss_701aa9c2f62f458fd3c9a2bd9561ad5e7f41f662.1920x1080.jpg?t=1653584490,https://cdn.akamai.steamstatic.com/steam/apps/374320/ss_975ca4966b9b627f8d9bb0d2c9b6743dfceac6da.1920x1080.jpg?t=1653584490","http://cdn.akamai.steamstatic.com/steam/apps/256659154/movie_max.mp4?t=1511366817,http://cdn.akamai.steamstatic.com/steam/apps/256662354/movie_max.mp4?t=1511366784"
